排名,标题,描述,链接,图像,热度,关注者,被浏览量,总回答数,是否在榜,是否已生成ai总结,Hash,回答1,回答1点赞数,回答2,回答2点赞数
1,于东来透露胖东来员工平均工资 9886 元，店长级月薪高达 78058 元，怎样看这一水平？,财联社 3 月 29 日电，胖东来创始人于东来 3 月 28 日在 2025 中国超市周上公开透露，2025 年 1—2 月份，在交完社保以后，胖东来员工工资是 9886 元。此外，于东来还透露，2025 年胖东来管理层的工资跟 2024 年相比也有很大的变化。活动现场播放的 PPT 显示，胖东来有店长、店助、员工等八个级别，店长一级 2024 年月平均到手工资为 44193 元，2025 年月平均到手工资达到了 78058 元。胖东来员工平均工资是 9886 元,https://www.zhihu.com/question/1889315640545863336,https://pic3.zhimg.com/50/v2-cd535fd549bb2e2cfb8de4c9ccbdfc0a_400x224.jpg,209 万热度,1044,"1,569,569",419,False,False,24717033186594951513440833640279842963091520849430510967672768456386751220403,"['看着是冰冷的数字，却是触及灵魂的。', '今天还刷到于东来的一个视频，说的是山姆的工资太低了，要给员工增长。', '于东来表示，如果一家企业让员工拿不到，最起码4000块钱以上的收入，建议这些企业直接关了就行，不要在这里扰乱市场。', '当时看到这样的视频，觉得还是挺有意思的。毕竟于东东来敢这么说，就是人家企业自信的表现。', '但在我看来，于东来可能没明白一点，就是除了他以外，别的资本家是根本不想让所有人都开心的。', '就像很多老板的原话就是，请员工是来干活的，不是让他来享受开心的。', '现在又看到胖东来公布员工的平均工资，员工交完社保平均9886元，最低工资8300左右。', '所以，总算才明白，为什么胖东来的一个岗位能有上千人投递，甚至都有要赶超事业编的投递比例。', '这么光明正大的晒员工工资，完全无视所谓的薪资保密行为，这就是胖东来的魅力。', '在河南，一个于东来，一个崔培军，算是引领了企业家潮流。他们把对员工的好，直接落实到待遇层面，他们更懂得让利员工。', '对于员工来说，或许这才是真正的“工作”，才是真正的劳有所获吧。', '据了解，中国零售行业基层员工的平均月薪在3000到6000的区间，店长级岗位在一万到三万左右。', '你会发现胖东来的平均收入，确实是有点吓人。也难怪人家的流失率比较低，甚至有些岗位都没有招人需求，是真的没人愿意主动离职的。']",2459,"['以胖东来一贯的作风，以及2024年的业绩来看，实属正常。', '如果拉出来对比，那就是降维打击了。', '同行业，应该都找不到几个比胖东来的薪酬水平强的。', '关键是，胖东来这个平均工资，与咱们日常看到平均这个词的反应不一样。', '日常看到居民平均收入、平均消费、平均房价之类的，很多网友第一时间反应是：', '被平均了。', '在胖东来这里，员工平均工资，指的就是员工，不包含什么班长往上的8个级别，更不包含什么店长。', '而且胖东来的员工工资，差距并不大，2025年，其最低工资8329元每月，最高工资12848元每月。', '相比于2024年的工资，上涨了至少1000元每个月。', '从胖东来的工资基数来看，级别高一点的管理层工资比较高，其拿到手的工资与基本工资平齐或者更高，说明胖东来的绩效奖励等发放也不错。', '比如店长工资基数80000元每月，其到手工资达到了78058元每月，其社保公积金以及个人所得税，应该是拉满了。', '于东来要让员工都买得起房、买得起车，以他这个工资水平，在许昌来说，肯定是可以的。', '许昌房价均价不到6000元每平，以胖东来员工的到手收入，加上公积金等的助力，工作有个几年的，买房压力应该都不大。', '这也是此前于东来不允许员工靠父母买房买车的底气。', '能给员工发这么高的工资，哪儿还用的着靠父母呢。', '以胖东来这个工资水平，普通员工都可以积攒积攒实现买车买房的愿望，更不用说更高层的管理人员。', '2024年，胖东来全年销售额为169.64亿元，接近170亿元，同比增长28.3%，净利润高达8.09亿元。', '12月销售额为20.41亿元，', '其中许昌时代广场店的年销售额高达44.13亿元，这个店的店长和员工到手工资肯定是少不了的。', '就是因为胖东来业绩好、前途光明、待遇好，胖东来才会有那么低的员工流失率。', '而且这公司作为一个超市，每年假期还那么多，大部分员工每年有150天以上的假期，还有部分员工每年有180天以上的假期。', '于东来的愿望是，未来胖东来周六也不开店，让员工可以双休，可以陪伴家人，再继续给员工增加假期。', '正常人都期望在这种公司上班，如此好的平台，如此好的老板，如此给力的收入，简直是羡煞旁人。', '']",340
2,魔爪功能饮料到底有多恐怖？,本人一共喝了 3 次魔爪，每次喝完最少亢奋 24 小时，不觉得累，一点睡觉的欲望都没。,https://www.zhihu.com/question/330973224,https://pic3.zhimg.com/80/v2-8f91bad0d48c2f83f37aa6a04f260c92_400x224.png,193 万热度,436,"3,027,949",153,False,False,104626061331643438896337595655765315904109820252052645611224210352471873919517,"['很多人不了解中国的相关国标。', '居然有人因为魔爪的配料表里面没有咖啡因，只有瓜拉纳提取物，就觉得它咖啡因含量没有别的饮料高。', '恰恰相反，这是一个类似悖论的命题：配料表里只有不含咖啡因，才能含高浓度咖啡因。', '纯咖啡因在中国是受严格管控的，只有可乐型汽水和少数特批的功能饮料可以添加纯咖啡因，而且浓度限制极为严格。', '但是你随便泡一杯咖啡，泡一杯浓茶，咖啡因摄入量就可以到国标的好几倍。', '天然提取物，只要不是提纯后的咖啡因，对咖啡因浓度国标是没有规定的。', '食品添加剂，国家标准一般参考安全耐受值的1%以下，而作为食品原料，国家标准一般贴着安全耐受值。', '所以天然食品原料中含有的咖啡因，只要吃不死人，国家标准就允许你随便加。', '当你看到功能饮料配料表里面是咖啡提取物，茶叶提取物，瓜拉纳提取物的时候，你应该明白，这才是大boss来了。', '如果配料表里面只是咖啡因的话，那咖啡因含量反而不可能超过茶和咖啡。', '最后回答问题——魔爪到底有多恐怖？', '咖啡因浓到配料表里没咖啡因。']",1868,"['自己看配料表嘛。', '这玩意有红茶，绿茶，人参，咖啡，牛磺酸，瓜拉纳...几乎是把人类已知的所有合法的提神玩意儿全加进去了，能不恐怖嘛。', '但是对我来讲依然没啥用，仅仅能让我从“困得要死”变成“没那么困”而已，而咖啡红牛啥的我更是“睡前喝一杯睡得香”233333']",792
3,罪案剧《棋士》中有哪些细思极恐的细节？,,https://www.zhihu.com/question/15721910357,https://pic3.zhimg.com/50/v2-8111ea3fd112be6886be8b5d4bcc40a6_400x224.jpg,177 万热度,33,"78,145",20,False,False,63220569739696394104733622447626673428528683492713481896944183888790623707377,"['看了三集，真的细节满满。', '当王宝强饰演的阿业在信用社里面，被劫匪挟持的时候，他帮劫匪出了脱身的主意。', '他说的是，让一个人当弃子去引开警察，其他人就可以从后门下去，找到信用社经理的车，坐车离开。', '那么问题来了，他土生土长，知道这个信用社旁边是什么可以理解，他怎么知道后门有经理的车呢？', '这就不得不麻烦大家把进度条拉回去，看到阿业第一次去信用社取一百出门后，踩个破单车，结果差点撞上一辆车的事。', '有印象了吧？', '当时车里还有个人探出头骂了他一句。', '而那个地方，就是经理停车的地方，这个经理正在把车往外开。', '那么，问题又来了。', '他咋知道这个人是经理呢？', '那又不得不又请你把进度条往前拉，拉到阿业在信用社里取一百块钱的时候，柜台里面有个男的，在教女职员操作，那个男的，就是经理。', '镜头只是一瞬间，但是把整个事情的逻辑就连起来了。', '你别以为这个场景很小，好像毫无意义，其实信息量巨大。', '建议你仔细看，因为帮你们分析下一个细节的时候，还要用。', '以上三个画面总结起来，信息量的组合就是：', '阿业在信用社取钱，他听到柜台里面经理跟女职员的讲话，就注意到了经理的长相。是不是主打一个心细如发，记忆力超群？', '然后，他取了钱出门，走了一段路，一不小心差点撞上经理的车，他注意到了这个经理的停车位的位置，是不是主打一个生活无小事，事事都上心？', '最后，他在信用社里被挟持后，急中生智，想到了帮助劫匪逃脱的方案里，就用上了这个信用社经理的车！是不是主打一个心思缜密？', '这一套逻辑走下来，是不是不得不感慨，阿业一个这么记忆力超群，心细如发，应变能力满分的人，咋能过得这么窝囊呢？', '这，我们就不得不来到第二个细节。', '这部剧虽然暂时只放了三集，但是出现了几次这句话：', '这句话，是一种人生战术，而不是棋盘战术。', '为什么几次有人这样跟阿业说呢？', '因为他在这部剧开始的时间线之前，是不搞这一套的。', '他只是一个单纯的喜欢下棋的人。', '下棋讲究的是能力。', '比拼的是技术。', '谁强谁赢。', '所以下棋的世界很简单。', '一直沉浸在下棋世界里的阿业，把人生看成跟下棋一样了。', '但是人生不一样。', '人生有很多弯弯绕绕，讲究的是人情世故。', '为什么大家都想要他输？', '因为他不愿意输。', '他很较真。', '所以，他活得很窝囊，跟这个并不靠真才实学的社会格格不入。', '你看他在庆功会上，筹措良久不知道说啥，结果话筒被拿走。', '他事事都较真。', '他真的在想我应该说点什么。', '因为那个冠军，是他自己靠自己的能力得到的。', '但是，其实这个场合，校长的意思很明白了，你应该说什么还不清楚吗？', '肯定应该说感谢领导的栽培，感谢赞助商给的机会啊。', '你在那墨迹半天，太不懂事了。', '结合校长跟他私下的讲话，奖杯，要放在学校，奖金，校长要吞了，成就，说是集体的荣誉。', '一波操作下来，非常恶心，但却是社会常态。', '如果他是个圆滑的人，他其实可以跟校长之间好好谈谈利益分成，而不是就事论事。', '你想想他可以是各种围棋比赛的冠军，放到哪个兴趣班不是台柱子一样的存在？', '家长要是知道老师这么厉害，那不是抢破头送孩子去？', '但是你看看他上课那个样子，孩子那个捣蛋，薪水那个克扣，完全没有让自己的才能使用率最大化。', '但是，他没有意识到自己的思维跟这个世界的规则格格不入。', '在这部剧的时间线开始之前，他是不愿意输棋的，这是他多年下围棋形成的思维方式。', '所以，当校长说让他跟赞助商下棋的时候，他开始是拒绝的。', '要说这个要求是不是真的很过分呢？', '校长已经说的很明白了，就这么一个小小的要求，你都不答应，我怎么办？', '这个意思其实是，你是唯一能下棋的，你不去，总不能我去把，你不去，不是让我为难吗？', '他的回答是，不是说了不跟领导下棋吗？', '他的角度是，这些人期艺太差了，跟我下，确实是不配。', '但是领导的角度是，现在是期艺的问题吗？这是人情世故的的问题啊，把赞助商伺候好了，你才能参加比赛啊。', '人在屋檐下，要学会低头啊。', '阿业其实能说出这种话，就是他一直以来人生态度的写照，他把人生，活得跟下棋一样，一板一眼，有规有矩，直来直往，所以，他活成电视剧开始的样子：', '儿子崇拜大伯而不是他；', '妻子要跟他离婚，崇拜赞助商而不是他；', '虽然其实他应该是工作单位的台柱子，但是他完全被边缘化。', '生活不知不觉，就到了一个命运的十字路口了。', '更多细节，下次更新。', '这部剧，很值得细品。']",135,"['看《棋士》这剧最吓人的地方，是它把那些最普通的生活细节都埋成了雷。', '先说信用社那场戏。崔业去取钱，经理开车差点撞到他，他抬头看了眼墙上“信用社专用停车位”的牌子。这个镜头晃过去的时候，我以为就是拍个环境，结果后面劫案发生，他直接让劫匪抢经理的车逃跑。这时候才反应过来，这哪是闲笔？这是崔业第一次露出獠牙——表面老实巴交，心里早就把仇记小本本上了。更绝的是，这场戏里营业员提了一嘴“秦晓铭怎么没来”，后面这人就被绑架了，连名字都是提前三个月埋的伏笔。', '再看奖杯和水杯。崔业得了围棋冠军，奖杯被校长扣着不让拿回家，说是要摆着拍照。结果镜头扫过去，奖杯旁边崔业的水杯是空的，别人杯子里都有水。这哪是道具失误？这就是明晃晃告诉你：在权力眼里，你崔业连口水都不配喝。后来校长给他个假奖杯糊弄，塑料底座掉漆那块特写，跟抽他耳光似的——你的人生就是个山寨货。', '最绝的是围棋课上的“逢危须弃”。崔业上课讲这个战术时，底下学生拿棋子砸他，没人听。结果后来他帮劫匪逃跑，真就用这招让人当“弃子”引开警察。这时候才看懂，这堂课根本不是教孩子，是导演在教观众：你看，连教书育人的课堂都在教人怎么卖队友，这世界烂透了。更吓人的是，崔业后来策划抢劫时，在黑板上画的逃跑路线就是棋谱里的“屏风马布局”，把活人当棋子摆弄。', '家庭戏里的细节更诛心。崔业给儿子买肯德基，只舍得买个白胡子老头玩具，回家发现窗台上摆着哥哥送的全套奇奇储蓄罐。他把自己买的那个换上去，把哥哥的扔了。这个动作比什么犯罪现场都吓人——亲兄弟之间的嫉妒，能让人连孩子的玩具都算计。后面他烧香求“功德圆满”，香炉里插九根香只为自己，儿子生病、老妈身体差提都不提，这时候再看换玩具那段，简直就是人性堕落的预告片。', '还有那些年代道具，全是杀人不见血的刀。崔业腰间的BP机，每次震动都跟催命符似的；少年宫破牌匾下挂着“珠心算”广告，暗示围棋班早就是没人理的边缘项目；连肯德基儿童套餐的包装盒都在捅刀子——崔业咬牙买的汉堡，在哥哥的庆功宴上成了施舍他的冷饭。这些破烂玩意堆起来，比什么凶杀现场都真实，因为你我都活在这种细节构成的世界里。', '最细思极恐的还是崔业这个人。表面看是被逼上梁山，其实早就有反骨。他去信用社取一百块钱都要较劲，因为营业员跟经理说话没正眼看他；被劫持时第一反应不是害怕，而是用围棋思维盘算怎么脱身。这种藏在懦弱外表下的控制欲，比明着坏的反派更可怕。就像他哥说的：“你也在笼子里”，但崔业的笼子是他自己用三十年的憋屈一根根焊出来的。', '说白了，《棋士》里的恐怖从来不是血浆尸体，而是每个观众都能在自己生活里找到对应的细节。你老板克扣奖金的样子像不像那个校长？你亲戚饭桌上炫耀的样子像不像崔伟？那些被我们忍下来的委屈、咽下去的怒火，哪天会不会也变成崔业黑板上的犯罪路线？这才是真正的细思极恐——我们都在下一盘叫生活的棋，但谁知道执棋的到底是人是鬼。']",67
